column_name,data_type,intended_data_type,sample_values,missing_count,missing_pct,errors,description,recommended_actions
Undergraduate_Major,string,string,Computer Science | Music | Industrial Engineering | Political Science | Economics,0,0.0,,"Undergraduate major names stored as text. Contains 50 distinct, non-null values across 50 records (0% missing). All values are unique, representing a complete categorical listing of academic majors in this dataset.",[No Immediate Action]
Starting_Median_Salary,string,string,"$55,900.00 | $35,900.00 | $57,700.00 | $40,800.00 | $50,100.00",0,0.0,,"Starting median salary stored as currency-formatted text. All 50 records are non-null with 43 distinct values ranging from $34,000.00 to $74,300.00. Values are highly uniform, consistently using a leading dollar sign, comma thousands separator, and two decimal places.","[STANDARDIZE] Convert currency-formatted strings to numeric type by removing the '$' symbol and comma thousands separator: '$55,900.00' → 55900.00. | [VALIDATE] Ensure all values follow the format: leading dollar sign, comma thousands separator, exactly two decimal digits — e.g., '$55,900.00'."
Mid_Career_Median_Salary,string,string,"$95,500.00 | $55,000.00 | $94,700.00 | $78,200.00 | $98,600.00",0,0.0,,"Mid-career median salary stored as text in currency format with a leading '$', comma thousands separators, and a '.00' decimal suffix. All 50 records are non-null and contain 49 distinct values, with '$52,000.00' appearing twice. Observed value lengths are 10–11 characters depending on magnitude. Stored as string, which enforces lexicographic ordering (e.g., '$101,000.00' is evaluated as less than '$98,600.00') and prevents numeric aggregation.","[STANDARDIZE] Convert currency-formatted strings to numeric decimal by removing '$' and ',' characters: '$95,500.00' → 95500.00. Applies to 100% of records. | [VALIDATE] Ensure all values follow the format: a dollar sign, comma-separated thousands, and exactly two decimal places — e.g., '$95,500.00'."
Percent_change_from_Starting_to_Mid_Career_Salary,float64,float64,70.8 | 53.2 | 64.1 | 91.7 | 96.8,0,0.0,,"Numeric field representing the percentage change from starting to mid-career salary. Contains 50 records with no missing values. Values range from 23.4 to 103.5, with 48 distinct values across 50 records; only the values 56.2 and 103.5 appear more than once.",[No Immediate Action]
Mid_Career_10th_Percentile_Salary,string,string,"$56,000.00 | $26,700.00 | $57,100.00 | $41,200.00 | $50,600.00",0,0.0,,"Mid-career 10th percentile salary stored as text in consistent currency format (e.g., '$56,000.00'). All 50 records are non-null, with 45 distinct values ranging from $26,700.00 to $71,900.00.",[No Immediate Action]
Mid_Career_25th_Percentile_Salary,string,string,"$74,900.00 | $40,200.00 | $72,300.00 | $55,300.00 | $70,600.00",0,0.0,,"Mid-career 25th percentile salary stored as currency-formatted text (e.g., '$74,900.00'). Contains 50 records with no missing values and 48 distinct values. Observed salaries range from $36,500.00 to $87,300.00. All values follow a uniform 10-character pattern. Minimal duplication exists, with '$45,500.00' appearing more than once.",[No Immediate Action]
Mid_Career_75th_Percentile_Salary,string,string,"$122,000.00 | $88,000.00 | $132,000.00 | $114,000.00 | $145,000.00",0,0.0,,"Mid-career 75th percentile salary stored as currency-formatted text. All 50 records are non-null, with 44 distinct values. Every value follows a `$XX,XXX.00` or `$XXX,XXX.00` pattern. String storage causes lexicographic sorting anomalies: the reported minimum is `$100,000.00` and maximum is `$98,800.00`, whereas the actual observed range is `$70,500.00` to `$145,000.00`.","[STANDARDIZE] Convert currency-formatted strings to numeric type by removing '$' and ',' characters: '$122,000.00' → 122000.00, '$88,000.00' → 88000.00. | [VALIDATE] Ensure all values match the currency text format before conversion: a leading '$', comma-separated thousands, and two decimal places — e.g., `$122,000.00`."
Mid_Career_90th_Percentile_Salary,string,string,"$154,000.00 | $134,000.00 | $173,000.00 | $168,000.00 | $210,000.00",0,0.0,,"Mid-career 90th percentile salary stored as currency-formatted text across 50 degree records with no missing values. Contains 43 distinct values ranging from $96,400.00 to $210,000.00, indicating some salary overlap among degrees. All values uniformly display a leading dollar sign, comma separators, and two decimal places.","[STANDARDIZE] Convert currency-formatted strings to numeric type for analytical sorting and aggregation: '$154,000.00' → 154000.00, '$96,400.00' → 96400.00. | [VALIDATE] Ensure all values conform to the currency text format before conversion: a dollar sign followed by comma-separated thousands and two decimal places (e.g., '$154,000.00')."
