column_name,data_type,intended_data_type,sample_values,missing_count,missing_pct,errors,description,recommended_actions
School_Name,string,string,University of Iowa (UI) | University of Massachusetts (UMass) - Amherst | Grinnell College | University of Georgia (UGA) | University of Massachusetts (UMass) - Dartmouth,0,0.0,"near-duplicate values suggesting variants or typos: [['State University of New York (SUNY) at Buffalo', 'State University of New York (SUNY) at Potsdam']]","School or university name stored as variable-length text. All 269 records (100%) are non-null, with 249 distinct values indicating some repeated school names across rows. Values exhibit natural variation, including institutional abbreviations in parentheses (e.g., 'University of Iowa (UI)') and campus location suffixes (e.g., 'University of Massachusetts (UMass) - Amherst'). One near-duplicate pair was flagged by string similarity.",[CLARIFY] Review 1 near-duplicate pair before standardisation: 'State University of New York (SUNY) at Buffalo' vs 'State University of New York (SUNY) at Potsdam'. Verify with the data owner whether these represent distinct campus records or if one is a typo/variant requiring consolidation.
School_Type,string,string,Party | State | Liberal Arts | Engineering | Ivy League,0,0.0,,"School type classification stored as categorical text. Contains 269 records with no missing values and 5 distinct observed categories: 'Engineering', 'Ivy League', 'Liberal Arts', 'Party', and 'State'.",[No Immediate Action]
Starting_Median_Salary,string,string,"$44,700.00 | $46,600.00 | $42,600.00 | $44,100.00 | $43,200.00",0,0.0,,"Starting median salary for graduates, stored as 10-character currency text despite representing numeric monetary values. All 269 records are non-null and follow an identical '$XX,XXX.00' format. Values range from $34,800.00 to $75,500.00 across 145 distinct amounts.","[STANDARDIZE] Convert uniform currency strings to a numeric type for analytical use: '$44,700.00' → 44700.00. This applies to 100% of records. | [VALIDATE] Ensure all values follow the format: dollar sign, followed by 2 digits, a comma, 3 digits, a decimal point, and two zeros — e.g., '$44,700.00'."
Mid_Career_Median_Salary,string,string,"$83,900.00 | $88,200.00 | $76,600.00 | $86,000.00 | $77,700.00",0,0.0,,"Mid-career median salary stored as US currency strings (e.g., '$83,900.00'). All 269 records are non-null, with 168 distinct values. Observed amounts span from '$76,600.00' to '$126,000.00'. The string data type enforces lexicographic ordering, producing an inverted reported minimum ('$101,000.00') and maximum ('$99,600.00') that prevents numeric aggregation and accurate range queries.","[STANDARDIZE] Convert currency-formatted strings to numeric values by removing the '$' prefix and ',' thousands separators: '$83,900.00' → 83900.00. | [VALIDATE] Ensure all values follow the observed currency format: a leading dollar sign, digits with a thousands separator comma, and exactly two decimal places of '.00' — e.g., '$123,000.00'."
Mid_Career_10th_Percentile_Salary,string,string,"$32,100.00 | $50,900.00 | $55,200.00 | $40,100.00 | $48,200.00",38,0.1412639405204461,38 NULL values (14.1% of 269 records),"Mid-career 10th percentile salary stored as currency-formatted text. Contains 231 non-null values out of 269 records, with 38 missing values (14.1%). All non-null values follow a uniform '$XX,XXX.00' pattern and range from $22,600.00 to $80,000.00 across 141 distinct amounts. The column is stored as string despite representing monetary values.","[STANDARDIZE] Convert currency-formatted strings to numeric type by removing '$' and ',' characters: '$32,100.00' → 32100.00. | [CLARIFY] Confirm whether the 38 missing values (14.1%) are expected or whether this field is required for downstream use."
Mid_Career_25th_Percentile_Salary,string,string,"$61,100.00 | $61,300.00 | $65,100.00 | $57,800.00 | $56,200.00",0,0.0,,"Mid-career 25th percentile salary stored as currency-formatted text (e.g., `$61,100.00`). All 269 records are non-null with 178 distinct values. Values uniformly follow a `$XX,XXX.00` or `$XXX,XXX.00` pattern (100% currency format, uniformity score 0.993). Because the column is stored as strings, reported minimum (`$100,000.00`) and maximum (`$99,200.00`) reflect lexicographic rather than numeric ordering. Observed value lengths are 10–11 characters depending on magnitude.","[STANDARDIZE] Convert currency-formatted strings to numeric decimal by removing `$` and `,` characters — e.g., `$61,100.00` → `61100.00`, `$100,000.00` → `100000.00` — to enable correct mathematical and range operations. | [VALIDATE] Ensure all values conform to the currency text format: a leading dollar sign, digits with an optional comma thousands separator, and exactly two decimal places — e.g., `$61,100.00`."
Mid_Career_75th_Percentile_Salary,string,string,"$116,000.00 | $122,000.00 | $118,000.00 | $107,000.00 | $119,000.00",0,0.0,,"Mid-career 75th percentile salary stored as currency-formatted text. All 269 records (100%) are non-null with 110 distinct values. Values uniformly display a leading dollar sign, comma thousands separators, and two decimal places (e.g., '$116,000.00'). Observed value lengths vary between 10 and 11 characters based on salary magnitude. Because the column is stored as a string, reported minimum ('$100,000.00') and maximum ('$99,900.00') reflect lexicographic rather than numeric ordering.","[STANDARDIZE] Convert all currency-formatted string values (100%) to a numeric type: '$116,000.00' → 116000.00, '$99,900.00' → 99900.00. | [VALIDATE] Ensure all values follow the format: leading dollar sign, comma-separated thousands, and exactly two decimal places — e.g., '$116,000.00'."
Mid_Career_90th_Percentile_Salary,string,string,"$129,000.00 | $201,000.00 | $153,000.00 | $135,000.00 | $177,000.00",38,0.1412639405204461,38 NULL values (14.1% of 269 records),"Mid-career 90th percentile salary stored as currency-formatted text. Contains 231 non-null values out of 269 records, with 38 missing values (14.1%). All non-null values follow a uniform currency pattern (e.g., $129,000.00) with 98 distinct values. Stored as string, causing lexicographic ordering anomalies where the reported minimum ('$102,000.00') sorts after the reported maximum ('$98,900.00'). Observed value lengths vary between 10 and 11 characters depending on salary magnitude.","[STANDARDIZE] Convert currency-formatted strings to numeric by removing '$' and commas: '$129,000.00' → '129000.00', '$98,900.00' → '98900.00'. | [VALIDATE] Ensure all values follow the format: a leading dollar sign, digits with an optional comma as a thousands separator, and exactly two decimal places — e.g., $129,000.00. | [CLARIFY] Confirm whether 38 missing values (14.1%) are expected or if the field is required for downstream use."
