column_name,data_type,intended_data_type,sample_values,missing_count,missing_pct,errors,description,recommended_actions
Disease,string,string,Paralysis (brain hemorrhage) | Impetigo | Osteoarthristis | Typhoid | Psoriasis,0,0.0,,"Disease or medical condition name serving as the record identifier and join key to symptom_Description.Disease (97.6% bidirectional coverage). Contains 41 distinct, non-null values with no missing data. Several apparent typographical errors and formatting inconsistencies are present, including lowercase entry 'hepatitis A', double spaces in '(vertigo) Paroymsal  Positional Vertigo', missing space before parentheses in 'Dimorphic hemmorhoids(piles)', and suspected misspellings such as 'Paroymsal', 'Osteoarthristis', 'diseae', and 'hemmorhoids'.","[STANDARDIZE] Correct deterministic formatting issues: 'hepatitis A' → 'Hepatitis A', '(vertigo) Paroymsal  Positional Vertigo' → '(vertigo) Paroymsal Positional Vertigo', 'Dimorphic hemmorhoids(piles)' → 'Dimorphic hemmorhoids (piles)'. | [STANDARDIZE] Correct apparent misspellings to standard medical forms: 'Paroymsal' → 'Paroxysmal', 'Osteoarthristis' → 'Osteoarthritis', 'diseae' → 'disease', 'hemmorhoids' → 'hemorrhoids'. | [VALIDATE] Verify all values match corresponding entries in symptom_Description.Disease to maintain referential integrity for the join key."
Precaution_1,string,string,massage | soak affected area in warm water | acetaminophen | eat high calorie vegitables | wash hands with warm soapy water,0,0.0,"near-duplicate values suggesting variants or typos: [['Consult nearest hospital', 'consult nearest hospital']]","First-line precaution or self-care recommendation associated with a symptom, stored as free-text. Contains 32 distinct values across 41 records with no missing values. Values include medical and lifestyle instructions such as 'massage', 'acetaminophen', and 'wash hands with warm soapy water'. One near-duplicate pair due to inconsistent casing was identified: 'Consult nearest hospital' and 'consult nearest hospital'.",[STANDARDIZE] Unify casing for the near-duplicate pair: 'Consult nearest hospital' → 'consult nearest hospital'.
Precaution_2,string,string,eat healthy | use antibiotics | consult nearest hospital | antiboitic therapy | stop bleeding using pressure,0,0.0,,"Second precaution recommendation for a symptom, stored as free-text medical/health advice. Contains 34 distinct values across 41 records with no missing values (0%), indicating some precautions are shared across multiple symptoms. Several observed values contain apparent misspellings (e.g., 'antiboitic', 'asprin', 'oinments').","[STANDARDIZE] Correct observed misspellings using canonical forms: 'antiboitic therapy' → 'antibiotic therapy', 'chew or swallow asprin' → 'chew or swallow aspirin', 'use detol or neem in bathing water' → 'use Dettol or neem in bathing water', 'use oinments' → 'use ointments', 'wash hands through' → 'wash hands thoroughly'."
Precaution_3,string,string,use lemon balm | avoid cold food | warm bath with epsom salt | keep infected area dry | maintain healthy weight,1,0.024390243902439025,1 NULL values (2.4% of 41 records),"Third precaution recommendation for a symptom, stored as free-text. Contains 30 distinct short imperative phrases across 40 non-null records, with 1 missing value (2.4%). Values consist of actionable health advice (e.g., 'use lemon balm', 'avoid cold food', 'maintain healthy weight'), with some precautions repeated across multiple symptoms.",[No Immediate Action]
Precaution_4,string,string,consult doctor | consume alovera juice | limit alcohol | medication | salt baths,1,0.024390243902439025,1 NULL values (2.4% of 41 records),"Fourth precaution recommendation for symptoms, stored as free-text. Of 41 total records, 1 value is missing (2.4%). There are 24 distinct non-null values among 40 populated records, indicating some precautions are shared across multiple conditions. Observed entries include 'consult doctor', 'consume alovera juice', 'limit alcohol', 'medication', and 'salt baths'.",[No Immediate Action]
